start,dur,text
1.42,7.12,[Music]
5.23,7.489,[Applause]
8.54,6.04,good morning good morning wonderful to
12.719,4.831,be back here at Shoreline with to all of
14.58,6.3,you it's been a really busy few months
17.55,5.19,for us at Google we just wrapped up
20.88,5.43,cloud next to the San Francisco with
22.74,7.08,"over 30,000 attendees as well as YouTube"
26.31,5.129,brand cast last week in New York of
29.82,3.93,course today's about you all our
31.439,4.681,developer community and thank you all
33.75,4.26,for joining us in person and to the
36.12,4.68,millions around the world watching on
38.01,4.639,livestream I would love to say welcome
40.8,3.96,in all the languages our viewers speak
42.649,3.73,but we are going to keep the keynote
44.76,3.569,under two hours especially since
46.379,6.331,Barcelona kicks off against Liverpool
48.329,8.491,that known for you should be an amazing
52.71,5.31,game every year at i/o we learn and try
56.82,3.21,to make things a little bit better
58.02,4.769,that's why we have lots of Sun screen
60.03,4.949,hope the Sun comes out plenty of water
62.789,5.041,and shade but this year we want to make
64.979,6.361,it easier for you to get around so we
67.83,6.149,are using a are to help to get started
71.34,5.16,open your eye o app and choose explore
73.979,4.771,i/o and then you can just point your
76.5,4.13,phone where you want to go we really
78.75,3.96,hope this helps you get around and
80.63,5.65,answers the number one question people
82.71,4.86,have where the sessions are actually
86.28,5.28,it's not that they want to know where
87.57,6.72,the food is and we have plenty of it
91.56,5.36,around we also have a couple of Easter
94.29,5.46,eggs and we hope you enjoy them as well
96.92,4.72,this is a pretty compelling use case and
99.75,4.229,we actually want to generalize this
101.64,3.979,approach so that he can explore and
103.979,5.07,navigate the whole world that way
105.619,6.04,there's a lot of hard work ahead and
109.049,4.971,it's a hard computer science problem but
111.659,5.07,it's the type of challenge we love
114.02,5.25,tackling these kinds of problems is what
116.729,5.82,has kept us going for the past 21 years
119.27,5.08,and it all begins with our mission to
122.549,4.021,organize the world's information and
124.35,5.73,make it universally accessible and
126.57,4.86,useful and today our mission feels as
130.08,4.31,relevant
131.43,6.21,Simar but the way we approach it is
134.39,6.909,constantly evolving we are moving from a
137.64,7.01,company that helps you finances to a
141.299,6.66,company that helps you get things done
144.65,6.22,this morning we'll introduce you to many
147.959,5.28,products built on a foundation of user
150.87,6.239,trust and privacy and I'll talk more
153.239,6.541,about that later we want our products to
157.109,6.151,work harder for you in the context of
159.78,6.81,your job your home and your life and
163.26,6.03,they all share a single goal to be
166.59,5.459,helpful so we can be there for you in
169.29,3.379,moments big and small over the course of
172.049,4.951,your day
172.669,7.3,for example helping you write your
177,6.03,emails faster with automatic solutions
179.969,6,from smart reply and giving you the
183.03,5.239,chance to take them back if you didn't
185.969,4.95,get it right the first time
188.269,5.86,helping you find the fastest route home
190.919,6.391,at the end of a long day and when you
194.129,5.461,get there removing distractions so that
197.31,5.25,you can spend time with the people most
199.59,5.639,important to you and when you capture
202.56,7.22,those perfect moments backing them up
205.229,7.65,automatically so you never lose them
209.78,6.28,simply put our goal is to build a more
212.879,5.881,helpful Google for everyone and when we
216.06,6.199,say helpful we mean giving you the tools
218.76,7.8,to increase your knowledge success
222.259,6.13,health and happiness we feel so
226.56,4.709,privileged to be developing products for
228.389,5.25,billions of users and with that scale
231.269,4.71,comes a deep sense of responsibility to
233.639,5.701,create things that improve people's
235.979,5.641,lives by focusing on these fundamental
239.34,6.84,attributes we can empower individuals
241.62,6.269,and benefit society as a whole of course
246.18,4.979,building a more helpful Google for us
247.889,6.09,always starts with search and the
251.159,5.311,billions of questions users trust Google
253.979,6.781,with every day but there is so much more
256.47,5.85,we can do to help our users last year we
260.76,3.84,launched a new feature in Google News
262.32,4.02,called full coverage
264.6,4.38,and we have gotten great feedback on it
266.34,5.49,from our users will be bringing full
268.98,5.55,coverage directly to search to better
271.83,6.48,organize results for news related topics
274.53,6.51,let's take an example if you search for
278.31,5.52,black hole will surface the relevant top
281.04,4.8,news it was in the news recently we use
283.83,4.86,machine learning to identify different
285.84,5.37,types of stories and give you a complete
288.69,5.76,picture of how a story is being reported
291.21,5.91,from a wide variety of sources you can
294.45,5.28,click into full coverage it surfaces a
297.12,4.8,breadth of content but allows you to
299.73,4.62,drill down into what interests you you
301.92,5.46,can check out different aspects of the
304.35,6.09,story like how the black hole got its
307.38,5.37,name you can even now see a timeline of
310.44,6.11,events and we'll be bringing this to
312.75,5.82,search later this year podcasts are
316.55,5.14,another important source of information
318.57,7.23,and we'll be bringing them directly to
321.69,6.87,search as well by indexing podcasts we
325.8,5.49,can surface relevant episodes based on
328.56,4.77,their content not just a title and you
331.29,5.28,can tap to listen right in search
333.33,6.15,results or you can save an episode for
336.57,6.03,listening later on your commute or your
339.48,4.95,Google home these are all examples of
342.6,4.62,how we are making search even more
344.43,5.04,helpful for our users surfacing the
347.22,5.37,right information in the right context
349.47,6.36,and sometimes what's most helpful and
352.59,7.62,understanding the world is being able to
355.83,7.29,see it visually to show you how we are
360.21,6.41,bringing you visual information directly
363.12,4.06,in search here sup or not
366.62,9.899,[Music]
367.18,9.339,[Applause]
376.66,4.54,whether you're learning about the solar
378.95,5.67,system or trying to choose a color
381.2,6.33,scheme for your home seeing is often
384.62,5.7,understanding with computer vision and
387.53,3.39,augmented reality the camera in our
390.32,3.06,hands
390.92,4.5,is turning into a powerful visual tool
393.38,6.03,to help you understand the world around
395.42,7.5,you so today we are excited to bring the
399.41,5.31,camera to Google search adding a new
402.92,4.35,dimension to your search results
404.72,5.67,actually three dimensions to be precise
407.27,6.51,so let's take a look say you're a
410.39,5.07,student studying human anatomy now when
413.78,5.28,you search for something like muscle
415.46,6.3,flexion you can view a 3d model built by
419.06,7.62,visible body right from the search
421.76,7.89,results not only that pretty go not only
426.68,11.37,that you can also place it in your own
429.65,11.73,space look it's one thing to read about
438.05,6.03,flexion or extensions but seeing it in
441.38,5.48,action right in front of you while
444.08,5.49,you're studying the concept very handy
446.86,4.9,okay let's take another example say
449.57,5.46,instead of studying your shopping for a
451.76,5.88,new pair of shoes that happens with New
455.03,5.4,Balance you can look at shoes up close
457.64,5.58,from different angles again directly
460.43,5.13,from search that way you get a much
463.22,5.01,better sense for things like what does
465.56,6.74,the grip look like on the sole or how
468.23,4.07,they match with the rest of your clothes
475.86,6.429,okay this last example is a really fun
479.38,4.439,one so you may have all seen a great
482.289,4.921,white shark in the movies
483.819,7.861,jaws anyone but what does it actually
487.21,6.51,look like up close let's find out shall
491.68,4.65,we okay
493.72,5.16,I have Archana here with me to help with
496.33,5.94,the demo so let's go ahead search for
498.88,5.099,great white shark on Google as you
502.27,5.1,scroll through you get information on
503.979,6.69,the knowledge panel facts but also see
507.37,6.81,the shark in 3d directly from the
510.669,7.321,knowledge panel why don't we go one step
514.18,12.93,further why don't we invite the shark to
517.99,12.09,the stage you know it's one thing to
527.11,5.57,read a fact like a great white can be
530.08,6.12,anywhere between 17 feet to 21 feet long
532.68,5.83,but to see it in front of you at scale
536.2,3,filling up the shoreline stage like a
538.51,3.74,rock star
539.2,5.61,that is truly understanding its scale
542.25,6.76,okay let's take a closer look it's an AR
544.81,6.839,shark it won't bite oh look at those
549.01,4.829,layers of teeth you know I don't know
551.649,4.38,about you all but I'd much rather see
553.839,7.431,these teeth up close and a R than in
556.029,5.241,real life thank you Archana
563.13,5.71,really excited about bringing the camera
566.08,5.55,and a our capabilities to Google search
568.84,4.92,now sometimes though the things that
571.63,5.01,you're interested in they're difficult
573.76,6.24,to describe in a search box so that's
576.64,6.3,why we created Google lense to help you
580,6.69,search and do more with what you see by
582.94,7.14,simply pointing your camera we've built
586.69,5.64,lens as a capability across products so
590.08,4.95,you can access it directly from the
592.33,5.4,Google assistant but we've also built it
595.03,6.99,into Google photos and the camera app on
597.73,7.71,many Android devices people have already
602.02,6.3,used lens more than a billion times so
605.44,5.76,far and abused it to ask questions about
608.32,5.58,what they see like what kind of flower
611.2,7.08,that is or where to get a lamp like that
613.9,6.33,or just who the artist is one way we've
618.28,4.26,been thinking about it is with lens
620.23,5.16,we're indexing the physical world
622.54,6,billions of places and products and so
625.39,6.54,on much like search indexes the billions
628.54,5.58,of pages on the web okay
631.93,5.24,today let me show you some new ways that
634.12,5.73,we're making lens more helpful to you
637.17,5.29,say you're at a restaurant trying to
639.85,4.95,figure out what to order instead of
642.46,4.44,going from the menu to different apps on
644.8,7.22,the phone and back to the menu and so on
646.9,7.8,you can simply point your camera lens
652.02,5.68,automatically highlights the popular
654.7,5.18,dishes at this restaurant right on the
657.7,2.18,menu
663.019,5.981,and of course if you want to know more
666.12,5.55,you can tap on any dish on the menu and
669,7.68,you can see what it looks like again at
671.67,6.96,the restaurant and of course check out
676.68,6.33,what other people are saying about it on
678.63,7.55,Google Maps by the way when you're done
683.01,6.24,eating lens can help pay for your meal
686.18,7.06,not so fast it's not picking up your tab
689.25,8.88,but it can calculate the tip and even
693.24,9.5,split the total again just by pointing
698.13,4.61,your camera at the receipt and voila
707.77,6.1,so you saw how we connected the menu
710.69,4.589,with information from Google Maps but
713.87,3.9,we're starting to think of other ways
715.279,4.891,that we can connect helpful digital
717.77,4.53,information with the things in the
720.17,3.48,physical world so I'm going to give you
722.3,3.75,just one example
723.65,4.61,so you're flipping through a Bon Appetit
726.05,5.4,magazine and you see a recipe you like
728.26,7.89,soon you can point your camera at the
731.45,8.13,recipe and see the page come alive
736.15,5.71,showing you how to make the dish we're
739.58,4.8,starting to work with more partners like
741.86,4.89,museums magazine publishers and
744.38,8.01,retailers to bring unique visual
746.75,8.279,experiences like this there's one final
752.39,5.82,area where we think that the camera can
755.029,5.281,be particularly helpful to people around
758.21,4.95,the world there are more than 800
760.31,4.86,million adults for struggling to read
763.16,5.49,the words that they come across in their
765.17,6.33,daily lives bus schedules Bank forms etc
768.65,6.27,and many of them are coming online for
771.5,5.97,the first time with a smartphone so to
774.92,6.51,help with that we've integrated a new
777.47,7.489,camera capability into Google go this is
781.43,7.82,our search app for entry-level devices
784.959,7.031,take this sign in English next to an ATM
789.25,5.43,now for someone who does not understand
791.99,5.49,the language and cannot read the words
794.68,5.77,this is important information that
797.48,4.89,they're not getting access to and we
800.45,5.579,think that the camera can help here so
802.37,7.589,let me show you how so directly from the
806.029,6.75,Google search bar you can use lens open
809.959,7.021,it point it at the sign to hear the text
812.779,6.541,read out aloud to you information for
816.98,4.38,card holders all customers using old
819.32,2.87,proprietary magnetic stripe cards should
821.36,3.51,be advised
822.19,4.72,what is nice here is that it is
824.87,4.68,highlighting the words as they're spoken
826.91,5.369,that way even if you can't read the
829.55,4.89,language well you can follow along and
832.279,5.761,you understand the full context of what
834.44,6.209,you see you can also translate it into
838.04,5.76,your own language
840.649,3.151,like this
847.999,4.62,notice that the translated text is
850.519,5.13,overlaid right on top of the original
852.619,5.55,sign you know it almost feels like the
855.649,5.64,sign was written in your own language to
858.169,5.7,start with and again you can hit listen
861.289,4.95,and hear the words read out loud this
863.869,10.351,time in your own language información
866.239,11.481,para los titulares de la tarjeta what
874.22,6.899,you're seeing here is text speech
877.72,5.649,computer vision the power of translate
881.119,5.49,and twenty years of language
883.369,7.98,understanding from search all coming
886.609,6.87,together now our teams in India have
891.349,4.17,been working with some early testers and
893.479,4.14,getting a lot of feedback to make the
895.519,4.65,product better and I want to now show
897.619,12.42,you how one of them is using it in her
900.169,16.29,daily life take a look if you get any
910.039,9.14,value merit in bikini it's cool man
916.459,2.72,Jatin
919.21,6.09,oh but you go home back receptor
921.96,5.07,ligand telomere watch it see our whole
925.3,7.02,day
927.03,9.14,- Roxanna qualidade will be perolli kako
932.32,6.619,combo bonito kar sakthe
936.17,5.669,Barbican apertium Logan KK mclubbe
938.939,2.9,chorus are patottie
942.199,4.721,would you believe are the same but you
945.779,5.24,go my love
946.92,7.469,barbar captain Eid mclubbe for tool a
951.019,5.74,d-cup swapping by Yumi charka panadol
954.389,3.151,guru Bali though is named for a kazoo
956.759,4.95,nya
957.54,8.82,Oh Jason McLeod report card ow Motoko a
961.709,6.42,greasy Hindi got it we can Musa
966.36,3.959,botticella become a clafouti
968.129,4.231,dirty Gemma club just two days after
970.319,2.671,McCarthy league abroad but you can't
972.36,6.63,delay it
972.99,8.459,Charu cata budget cut off a bidet of
978.99,5.37,just a real Vegas ticket katana the
981.449,5.631,bharatas actio KCK Sarah Newlin Appleton
984.36,8.619,a plasma Baja veteran
987.08,5.899,[Music]
996.77,5.47,thank you Ramallah for testing it and
999.839,6.211,giving us a lot of feedback for the team
1002.24,6.469,to make the product better the power to
1006.05,6.229,read is the power to buy a train ticket
1008.709,7.961,to shop in a store to follow the news
1012.279,6.31,it's the power to get things done so we
1016.67,4.89,want to make this feature accessible to
1018.589,6.23,as many people as possible so it already
1021.56,6.45,works in more than a dozen languages and
1024.819,5.651,the teams worked incredibly hard to
1028.01,11.46,compress all of this tech to just over a
1030.47,14.64,hundred kilobytes that way it can work
1039.47,8.219,on phones that cost as little as $35 so
1045.11,4.59,we're super excited about this and all
1047.689,4.041,the other features across search and
1049.7,4.59,lens to help you throughout the day
1051.73,5.34,you'll start to see these updates roll
1054.29,5.73,out later this month thank you
1057.07,5.14,[Applause]
1060.02,5.289,[Music]
1062.21,3.099,[Applause]
1066,8.26,thanks Aparna helpfulness is also about
1071.049,6.361,saving time and making your day a little
1074.26,6.09,bit easier that's why last year at i/o
1077.41,7.379,we gave you a first look at our duplex
1080.35,6.09,technology duplex enables Google
1084.789,4.441,Assistant to make restaurant
1086.44,6.3,reservations on your behalf by actually
1089.23,6.87,placing a call it's now available in 44
1092.74,6.36,states across the US and we've gotten
1096.1,6.89,great feedback not only from our users
1099.1,6.449,but from businesses as well for us
1102.99,6.52,duplexes to approach by which we train
1105.549,8.191,AI on simple but familiar tasks to
1109.51,5.49,accomplish them and save you time duplex
1113.74,4.11,was launched with restaurant
1115,6.48,reservations on the phone but now we are
1117.85,7.47,moving beyond voice and extending duplex
1121.48,6.809,to tasks on the web we again want to
1125.32,4.8,focus on narrow use cases to start so we
1128.289,5.431,are looking at rental car bookings as
1130.12,6.27,well as movie ticketing today when you
1133.72,5.03,make a new reservation online you have
1136.39,5.399,to navigate a number of pages and steps
1138.75,4.659,filling out information and making
1141.789,3.811,selections along the way I'm sure you're
1143.409,4.801,all familiar with this experience it's
1145.6,4.62,time consuming and if users leave during
1148.21,4.17,the work flow businesses lose out as
1150.22,5.91,well we want to make this experience
1152.38,5.909,better for both users and businesses so
1156.13,4.65,let me show you how the assistant can do
1158.289,5.52,it better say you get a calendar
1160.78,5.009,reminder about an upcoming trip and you
1163.809,4.921,want to book a rental car you can just
1165.789,4.201,ask google book a national car rental
1168.73,3.96,for my next trip
1169.99,6,the assistant opens the national website
1172.69,6.44,and automatically starts filling out
1175.99,7.049,your information on your behalf
1179.13,7.029,including the dates of the trip you can
1183.039,6.181,confirm the details with just a tab and
1186.159,6,then the assistant continues to navigate
1189.22,5.97,the site it even selects which car you
1192.159,5.25,like it's acting on your behalf and
1195.19,4.01,helping you save time but you're always
1197.409,5.001,in control of the flow
1199.2,6.19,let's go ahead and add a car seat and
1202.41,5.74,once all the details are in you can
1205.39,6.06,check everything one last time and just
1208.15,6.29,tap to finalize the reservation you'll
1211.45,5.55,immediately get a booking confirmation
1214.44,6.25,it's amazing to see the assistant
1217,7.2,complete a task online on your behalf in
1220.69,5.43,a personalized way it understands the
1224.2,4.59,dates of your trip and your car
1226.12,5.91,preferences based on trip confirmations
1228.79,5.88,in Gmail I also want to point out that
1232.03,5.28,this was not a custom integration this
1234.67,5.4,required no action on part of the
1237.31,4.92,business to implement what you just saw
1240.07,6.39,is an early preview of what we are
1242.23,6,calling duplex on the web we're going to
1246.46,3.51,be thoughtful and get feedback from both
1248.23,3.69,users and businesses to improve the
1249.97,6.8,experience and we'll have more details
1251.92,4.85,to share later this year
1261.27,4.99,the Google assistant helps people around
1264.49,3.83,the world with all kinds of tasks
1266.26,4.95,whether they are at home or on the go
1268.32,6.04,but we want to build an even more
1271.21,5.64,helpful assistant in order to process
1274.36,5.04,speech today we rely on complex
1276.85,6.36,algorithms it includes multiple machine
1279.4,7.5,learning models one model Maps incoming
1283.21,5.64,sound bites into phonetic units another
1286.9,5.37,one takes and assembles these phonetic
1288.85,5.73,units into words and then a third model
1292.27,5.19,predicts the likelihood of these words
1294.58,4.29,in a sequence they are so complex that
1297.46,4.31,they require hundred gigabytes of
1298.87,5.37,storage and a network connection
1301.77,4.78,bringing these models to your phone
1304.24,4.35,think of it as putting the power of a
1306.55,4.08,googol data center in your pocket
1308.59,5.4,it's an incredibly challenging computer
1310.63,6.299,science problem I'm excited to share we
1313.99,5.34,reached a significant milestone further
1316.929,5.791,advances in deep learning have allowed
1319.33,5.84,us to combine and shrink the hundred
1322.72,5.67,gigabyte models down to half a gigabyte
1325.17,7.72,small enough to bring it on to mobile
1328.39,7.61,devices this eliminates network latency
1332.89,6.69,and makes the assistant so much faster
1336,7.36,so fast that tapping to use your phone
1339.58,5.64,would seem slow I think this is going to
1343.36,5.22,transform the future of the assistant
1345.22,5.43,and I'm thrilled to bring Scott to tell
1348.58,4.57,you more about our next generation
1350.65,3.3,assistant
1353.15,1.35,[Applause]
1353.95,5.44,[Music]
1354.5,7.92,[Applause]
1359.39,5.43,thanks sundar well what if we could
1362.42,5.25,bring the AI that powers the assistant
1364.82,5.01,right onto your phone what if the
1367.67,4.59,assistant was so fast at processing your
1369.83,5.82,voice that tapping to operate your phone
1372.26,5.16,would almost seem slow it opens up many
1375.65,5.13,new use cases and we want to show you
1377.42,5.31,how fast it is now internally we've been
1380.78,4.74,calling this the next-generation
1382.73,5.52,assistant running on device it can
1385.52,5.49,process and understand requests in real
1388.25,6.66,time and deliver the answers up to 10
1391.01,5.97,times faster now Maggie's here and she's
1394.91,3.96,gonna help us test it out starting with
1396.98,4.74,some back-to-back commands to
1398.87,5.13,demonstrate its speed now this demo is
1401.72,4.17,hot off the press so please send your
1404,12.39,positive energy over a neg ease
1405.89,16.529,direction hey Google open calendar open
1416.39,11.85,calculator open photos set a timer for
1422.419,9.961,10 minutes what's the weather today what
1428.24,14.309,about tomorrow show me John Legend on
1432.38,14.85,Twitter get a lift ride to my hotel turn
1442.549,7.161,the flashlight on turn it off take a
1447.23,2.48,selfie
1455.24,11.41,all right now as you could see yeah I've
1463.14,6.33,often Meggie was able to open and
1466.65,4.47,navigate apps instantly now you might
1469.47,3.63,have also noticed that with continued
1471.12,4.44,conversation she was able to make
1473.1,5.97,several requests in a row without having
1475.56,5.1,to say hey Google each time now beyond
1479.07,3.27,an effortless way to operate your phone
1480.66,4.23,you can start to imagine how the
1482.34,5.97,assistant fused into the device could
1484.89,5.13,orchestrate tasks across apps let's look
1488.31,3.99,at another demo where Meg is chatting
1490.02,5.1,with a friend he's gonna ask her about a
1492.3,5.25,recent trip noticed how easy it is for
1495.12,11.34,her to respond with her voice and even
1497.55,12.65,share a photo reply had a great time
1506.46,3.74,with my family and it was so beautiful
1510.83,8.34,show me my photos from Yellowstone the
1516.3,2.87,ones with animals
1521.83,3.38,send it to Justin
1534.7,3.929,now another example is when a friend
1536.619,4.591,asks you a question and you need to look
1538.629,3.75,up the information to respond Justin
1541.21,3.69,wanted to know when Maggie's flight
1542.379,4.311,arrives when's my flight
1544.9,5.33,[Music]
1546.69,3.54,when's my flight
1552.86,4.49,reply I should get in around 1 p.m.
1557.74,5.65,alright so notice how it helped Maggie
1560.32,6.03,multitask more easily across different
1563.39,5.37,apps saving her a lot of back-and-forth
1566.35,4.449,now you can even imagine this next
1568.76,5.009,generation assistant handling more
1570.799,7.651,complex speech scenarios like composing
1573.769,12,and sending an email hey Google send an
1578.45,9.15,email to Jessica hi Jessica I just got
1585.769,5.701,back from Yellowstone and completely
1587.6,8.37,fell in love with it set subject to
1591.47,6.179,Yellowstone adventures let me know if
1595.97,7.309,next weekend works for dinner so I can
1597.649,5.63,tell you all about it send it
1610.85,4.47,now as you can see this required the
1613.279,4.441,assistant to understand when Maggie was
1615.32,4.229,dictating part of the message versus
1617.72,6.47,when she was asking it to complete an
1619.549,4.641,action thanks Maggie thanks Scott
1626.649,5.86,by moving these powerful AI models right
1630.169,4.771,onto your phone we're envisioning a
1632.509,4.861,paradigm shift this next generation
1634.94,4.589,assistant will let you instantly operate
1637.37,5.01,your phone with your voice multitask
1639.529,6.451,across apps and complete complex actions
1642.38,5.46,all with nearly zero latency and actions
1645.98,3.75,like turning on the flashlight opening
1647.84,4.53,Gmail or checking your calendar will
1649.73,4.26,even work offline now it's a very hard
