start,dur,text
3183.559,3.54,of people who were in lessons which we
3185.269,4.8,can then combine to build something that
3187.099,8.51,really works for everyone but understand
3190.069,5.54,we understood the absolute I'm doing
3205.26,4.93,we are working hard to provide these
3207.88,4.86,voice recognition models through the
3210.19,4.74,Google Assistant in the future but as
3212.74,4.59,you saw in Dimitri's case this will only
3214.93,5.85,be possible with many more speech
3217.33,6.63,samples to train our models on if you or
3220.78,5.7,someone you know has slurred or hard to
3223.96,5.46,understand speech we'd like to invite
3226.48,6.66,you to submit voice samples to help
3229.42,7.17,accelerate this effort fundamentally I
3233.14,6.15,research which enables new products for
3236.59,6.029,people with disabilities is an important
3239.29,6.84,way we drive our mission forward live
3242.619,7.141,transcribe live caption live relay and
3246.13,6.32,project fo Nia will ultimately result in
3249.76,5.52,products that work better for all of us
3252.45,6.01,it's a perfect example of what we mean
3255.28,6.42,by building a more helpful Google for
3258.46,6.33,everyone one of the most powerful ways
3261.7,4.97,we deliver help to our users is through
3264.79,4.65,our open source platforms like Android
3266.67,4.85,to tell you more I'd like to invite
3269.44,9.779,Stefan to the stage
3271.52,7.699,[Music]
3280.15,10.3,it's amazing we're here to talk about
3282.2,10.8,Androids version 10 and we get to
3290.45,5.73,celebrate a milestone together today
3293,10.41,there are over 2.5 billion active
3296.18,9.659,Android devices and today we want to
3303.41,6.24,walk you through what's coming next in
3305.839,6.121,Android queue innovation security and
3309.65,6.689,privacy the central theme of the Q
3311.96,6.42,release and digital well-being a lot has
3316.339,4.591,changed since one dot o smartphones have
3318.38,5.209,evolved from an early vision to this
3320.93,5.55,integral tool in our lives and they are
3323.589,5.141,incredibly helpful looking ahead we see
3326.48,5.52,another big wave of innovation coming to
3328.73,5.19,make them even more helpful QED shows
3332,4.559,Android shaping the leading edge of
3333.92,4.98,mobile innovation with over a hundred
3336.559,5.071,and eighty device makers around the
3338.9,4.83,world driven by this powerful ecosystem
3341.63,4.949,many innovations have been first on
3343.73,5.849,Android from large screens to the first
3346.579,5.431,OLED display and this year display
3349.579,4.561,technology will take an even bigger leap
3352.01,5.609,with foldables coming from multiple
3354.14,6.81,Android OMS these devices open up a
3357.619,5.521,completely new category which though
3360.95,4.889,early just might change the future of
3363.14,4.26,mobile computing foldables take
3365.839,3.931,advantage of a completely new display
3367.4,4.53,technology they literally Bend and fold
3369.77,5.339,from phone to tablet sized screen and
3371.93,5.85,cue maximizes what's possible on these
3375.109,5.401,screens for instance foldables are great
3377.78,4.92,for multitasking so I can watch some
3380.51,3.66,funny videos my sister sent me while we
3382.7,5.07,chat about what we're gonna do for my
3384.17,6.12,mom on mother's day but the feature I'm
3387.77,4.68,most excited about is screen continuity
3390.29,4.2,so let's say we finished chatting it's
3392.45,4.23,time to head out and I'm standing around
3394.49,5.099,waiting for my ride so I start playing a
3396.68,6.6,game on the folded smaller screen when I
3399.589,5.581,sit down and unfold the game seamlessly
3403.28,4.44,transfers to the larger screen it is so
3405.17,5.37,cool and I can pick up exactly where I
3407.72,5.58,was playing now multiple OMS will launch
3410.54,12.9,foldables this year all run
3413.3,14.07,Android another exciting innovation is 5
3423.44,7.41,g 5g networks mean consistently faster
3427.37,5.7,speeds with lower latency so apps and
3430.85,5.04,especially games can target rich
3433.07,5.49,immersive experiences to these 5g
3435.89,6.06,connected phones and Android Q supports
3438.56,5.73,5g natively this year more than 20
3441.95,5.58,carriers will launch networks and our
3444.29,5.7,OEMs have over a dozen 5g ready phones
3447.53,5.79,all launching this year and they'll all
3449.99,5.31,be running Android now in addition to
3453.32,4.68,hardware innovation we're also seeing
3455.3,5.85,huge firsts in software driven by
3458,6.12,advances in on device machine learning
3461.15,4.74,center showed live caption now I would
3464.12,3.63,really like you to see it in action
3465.89,4.07,and then take you under the hood please
3467.75,5.78,welcome Tristan
3469.96,6.46,[Applause]
3473.53,5.71,like many people I watch videos without
3476.42,4.68,sound when I'm on the go with captions I
3479.24,3.93,can still keep up even if I'm in a
3481.1,5.67,crowded space I'm sitting in a meeting
3483.17,6.03,so for me they're super helpful but for
3486.77,3.99,the almost 500 million people who are
3489.2,5.34,deaf or hard of hearing
3490.76,6.09,captions are critical today loads of
3494.54,4.44,mobile content embeds audio from video
3496.85,2.6,to voice messages and everything in
3498.98,3.33,between
3499.45,6.58,without captions this content is nowhere
3502.31,6.3,near as accessible live caption in Q
3506.03,5.16,takes audio and instantly turns it into
3508.61,4.62,text let's take a look at this video my
3511.19,5.34,friend Heather sent me yesterday to turn
3513.23,16.32,it on I open the volume rocker and tap
3516.53,15.33,the live caption body is walking away so
3529.55,4.68,as you can see these captions appear in
3531.86,5.16,real-time over a video that would
3534.23,6,normally never have captions you can
3537.02,6.24,expand them contract them move them up
3540.23,5.73,and down it's a lot of fun but what
3543.26,5.1,makes this feature so incredible is that
3545.96,3.39,it's entirely done on device in fact it
3548.36,4.83,doesn't need to be connected to the
3549.35,7.76,Internet at all if we take a look this
3553.19,3.92,entire demo I've done in airplane mode
3557.71,6.2,thank you thank you
3560.69,5.559,okay so how is this possible it's
3563.91,4.53,because of a huge breakthrough in speech
3566.249,2.731,recognition that we made earlier this
3568.44,2.97,year
3568.98,4.74,this one's required streaming audio to
3571.41,4.74,the cloud to run a two gigabyte model
3573.72,5.339,for processing now we can do that same
3576.15,6,processing on device using a recurrent
3579.059,5.19,neural net in just 80 megabytes the live
3582.15,5.669,speech model is running on the phone and
3584.249,6.09,no audio stream ever leaves it all this
3587.819,4.02,protects user privacy and this is OS
3590.339,4.49,wide which means you get those captions
3591.839,5.401,in all your apps and in web content too
3594.829,4.871,now the same on device machine-learning
3597.24,5.67,powers another useful cue feature which
3599.7,5.159,is smart reply with smart reply the OS
3602.91,4.56,helpfully suggests what you'll type next
3604.859,5.4,it'll predict the text you'll type even
3607.47,4.68,emoji and it's a huge time-saver what's
3610.259,4.86,really cool is this works now for all
3612.15,4.679,messaging apps and Android like in
3615.119,3.841,signal you can see the OS providing
3616.829,4.53,these helpful suggestions and smart
3618.96,4.44,reply can now even predict the actions
3621.359,2.821,that you'll take so say a friend sends
3623.4,2.609,you an address
3624.18,3.929,and normally you copy and paste that
3626.009,3.631,into maps that's kind of a hassle with
3628.109,4.051,smart reply you just tap and it will
3629.64,5.429,open for you and all this is saving you
3632.16,4.409,time on device machine learning powers
3635.069,3.361,everything from these incredible
3636.569,3.45,breakthroughs like live caption to
3638.43,4.379,helpful everyday features like smart
3640.019,5.611,reply and it does this with no user
3642.809,6.81,input ever leaving the phone all of
3645.63,5.28,which protects user privacy now there's
3649.619,2.611,one more addition to Android cue that's
3650.91,3.899,small but you've been asking us about
3652.23,5.539,for a while and that is dark theme and
3654.809,2.96,we're launching it and cue
3661.05,4.18,so you can activate it by using the
3663.609,3.391,quick tile or by turning on battery
3665.23,3.93,saver and in fact it will help you save
3667,4.32,battery your OLED display is one of the
3669.16,4.439,most power hungry components in your
3671.32,4.83,phone so by lighting up less pixels will
3673.599,5.791,save you battery so that's innovation
3676.15,5.78,but we feel all innovation must happen
3679.39,5.61,within a frame of security and privacy
3681.93,5.62,people now carry phones constantly and
3685,5.43,we trust them with a lot of personal
3687.55,5.549,information you should always be in
3690.43,5.07,control of what you share and who you
3693.099,4.681,share it with and that's why the central
3695.5,4.68,a second area will cover and the central
3697.78,5.61,focus of the release is security and
3700.18,5.16,privacy now over the years androids
3703.39,5.16,built out a huge set of protections
3705.34,6.269,already file based encryption SSL by
3708.55,6.12,default security and s work profiles and
3711.609,5.271,many of these were first on Android and
3714.67,5.1,Android has the most widely deployed
3716.88,6.91,security and anti-malware service of any
3719.77,6.72,OS with Google Play protect it runs on
3723.79,7.799,every device and it scans over 50
3726.49,7.47,billion apps a day in fact in Gartner's
3731.589,6.141,2019 security report which was published
3733.96,7.159,this week Android scored the highest
3737.73,6.43,possible rating in 26 out of 30
3741.119,5.651,categories it's ahead on multiple points
3744.16,6.06,from authentication to network security
3746.77,5.849,to malware protection and more at the
3750.22,4.379,same time we wanted to go much further
3752.619,4.771,and that's why Android q' includes
3754.599,5.101,almost 50 features focused on security
3757.39,6.09,and privacy all providing more
3759.7,5.94,protection transparency and control so
3763.48,4.02,first in queue we brought privacy to the
3765.64,3.87,top level in settings and there you'll
3767.5,2.97,find a number of important controls all
3769.51,3.39,in one place
3770.47,5.99,activity data location history add
3772.9,6.15,settings and you decide what's on or off
3776.46,4.78,now location is another place we've
3779.05,4.68,created tools for more transparency and
3781.24,4.47,control now location can be really
3783.73,4.859,helpful especially when you're lost in a
3785.71,5.25,new place but it's also some of your
3788.589,4.411,most personal information and you should
3790.96,4.29,again always be in control
3793,5.55,of who you share it with and how they
3795.25,5.01,can use it so first if you're wondering
3798.55,4.38,which apps can be accessing your
3800.26,5.19,location we make it easy for you to know
3802.93,5.01,with Q your device will give you helpful
3805.45,4.32,reminders whenever an app accesses
3807.94,4.89,location when you're not actively using
3809.77,5.57,that app so you can review and decide do
3812.83,5.7,you want to continue sharing or not
3815.34,5.23,second Q will give you more control over
3818.53,4.56,how you share location data with apps
3820.57,4.44,for example say you want to get pizza
3823.09,4.83,delivered you can choose to share your
3825.01,6,location only while the app is in use
3827.92,6.33,and as soon as you close you'll stop
3831.01,4.83,sharing location finally what if you're
3834.25,3.39,wondering what kind of location do all
3835.84,3.66,my apps have in queue we've brought
3837.64,4.29,location controls to the forefront in
3839.5,4.71,settings so you can quickly review every
3841.93,5.31,app and change location access with
3844.21,4.62,simple controls now there are many many
3847.24,4.58,more enhancements to security and
3848.83,5.18,privacy throughout the OS like TLS v3
3851.82,4.39,encryption for low-end devices
3854.01,4.15,randomizing your MAC address by default
3856.21,4.89,and many more and you can read about all
3858.16,5.04,of these in our blog post this week but
3861.1,4.14,there's one more really big thing for
3863.2,4.47,security now your Android device gets
3865.24,3.54,regular up security updates already but
3867.67,3.39,you still have to wait for the release
3868.78,5.04,and you have to reboot when they come we
3871.06,5.52,want you to get these faster even faster
3873.82,6.51,and that's why in cue we're making a set
3876.58,5.79,of OS modules updatable directly over
3880.33,3.9,the air so now these can be updated
3882.37,2.49,individually as soon as they are
3884.23,4.67,available
3884.86,4.04,and without a reboot of the device
3893.18,4.169,now this was a huge technical challenge
3895.309,4.591,for updating these in the background the
3897.349,4.051,same way we're updating Google Apps it's
3899.9,3.33,easier for our partners with whom we're
3901.4,4.26,working closely but more importantly
3903.23,3.839,it's much better for you you can learn
3905.66,3.78,more about this at the session what's
3907.069,3.75,new in Android now there's one more
3909.44,2.31,thing that's changed since the early
3910.819,2.76,days of Android
3911.75,3.69,now people carry smartphones everywhere
3913.579,4.561,because they're really helpful but we're
3915.44,5.31,also spending a lot of time on phones
3918.14,5.04,and people tell us sometimes they wish
3920.75,4.65,they'd spent more time on other things
3923.18,5.639,we want to help people find balance and
3925.4,5.37,digital well-being and yes sometimes
3928.819,4.77,this means making it easier to put your
3930.77,5.009,device away entirely and focus on the
3933.589,4.02,times that really matter that's why last
3935.779,4.08,year we launched digital well-being
3937.609,4.771,tools which dashboards app timers
3939.859,4.561,flipped ashesh and winddown
3942.38,4.26,to help you set the phone down and get
3944.42,4.59,to sleep at night and these tools are
3946.64,4.979,really helping app timers helped users
3949.01,5.819,stick to their goals over 90% of the
3951.619,5.761,time and users of wind down had a 27
3954.829,4.5,percent drop in night time usage if
3957.38,4.53,you're not using these already I would
3959.329,4.77,really recommend them but this year we
3961.91,4.379,want to help even more with distraction
3964.099,4.23,a lot of times I just want to sit down
3966.289,3.75,and focus to get something done and when
3968.329,2.911,I'm trying to do this like working maybe
3970.039,2.911,it's studying for you
3971.24,3.66,I don't want email or anything else to
3972.95,5.28,distract me and that's why we've created
3974.9,6.24,a new mode for Android it's called focus
3978.23,4.68,mode when I enter focus mode I can
3981.14,4.679,select the apps that I find distracting
3982.91,3.99,for me that's email the news so now
3985.819,3.451,they're turned off and I could really
3986.9,4.59,get to work those apps that distract me
3989.27,3.599,are disabled but I can still keep text
3991.49,4.349,because it's important to me that my
3992.869,4.17,family can always get a hold of me until
3995.839,3.331,I come out of focus mode and then
3997.039,6.321,everything is back focus mode is coming
3999.17,8.63,to devices on P and Q this fall
4003.36,7.12,[Applause]
4007.8,6.27,now finally I want to talk about
4010.48,6.42,families for 84% of us parents
4014.07,5.77,technology used by our kids is a top
4016.9,5.57,concern in the US the average age of
4019.84,5.58,kids getting phones is now eight in
4022.47,5.08,queue family linked parental controls
4025.42,4.23,will be built right into the settings of
4027.55,4.23,the device so when you set up a device
4029.65,5.07,for someone in your family family link
4031.78,5.28,will help connect it to a parent and you
4034.72,5.58,can review any apps that your child
4037.06,5.73,wants to install after that you can set
4040.3,4.26,daily screen time limits you can check
4042.79,4.38,where the apps where my kids are
4044.56,5.07,spending time and you can set a device
4047.17,5.37,bedtime so your kids can disconnect and
4049.63,5.64,get to sleep and now in Android cue you
4052.54,4.68,can set time limits on specific apps and
4055.27,3.72,when your child hits light device
4057.22,6.08,bedtime if you want to give them just
4058.99,4.31,five more minutes now we have Bonus Time
4065.67,3.52,now there's a ton more in queue that we
4067.75,3.45,don't have time to cover a ton
4069.19,4.11,everything from streaming media to
4071.2,5.04,hearing aids to better connectivity to
4073.3,5.28,new gesture UI and more so today I'm
4076.24,6.69,excited to announce that cue beta 3 is
4078.58,10.35,available on 21 devices that is twelve
4082.93,8.37,OEMs plus all pixels and that is more
4088.93,3.66,than double last year we hope you head
4091.3,2.85,over to the link to get it on your phone
4092.59,3.9,because we would love to have you try it
4094.15,11.31,out and now I will hand it over to Rick
4096.49,10.44,thank you very much thanks Steph well
4105.46,4.23,we've heard about some terrific
4106.93,4.8,innovations today an Android AI and the
4109.69,4.35,assistant and real breakthroughs and how
4111.73,4.17,we're able to help our users I'd like to
4114.04,3.78,spend a few minutes and talk about how
4115.9,4.95,some of those come to life and are made
4117.82,5.039,by Google products now we continue to
4120.85,4.62,believe that the biggest breakthroughs
4122.859,5.881,are happening at the intersection of AI
4125.47,5.94,software and hardware whether that's a
4128.74,5.33,tensor processing unit an entire data
4131.41,6.21,center the phone in your hand or a
4134.07,7.17,helpful smart display in your home let's
4137.62,7.11,start there the smart home of today is
4141.24,6.01,fragmented and frustrating to deliver
4144.73,4.23,real help in the home you can't start
4147.25,4.71,with technology you have to start with
4148.96,6.36,people and we've always worked to put
4151.96,6.42,people first and build technology around
4155.32,4.86,their needs there's no more important
4158.38,5.12,place to get this right than in the home
4160.18,3.32,let's take a look
4164.29,14.75,Oh as we roll down this unfamiliar Road
4180.089,20.011,this way just know you're not
4191.149,8.951,[Music]
4205.07,6.289,[Music]
4214.68,8.96,[Music]
4220.79,6.31,[Applause]
4223.64,5.32,your home is the most special place in
4227.1,4.71,your life so we need to be thoughtful
4228.96,5.25,about the technology we create for it by
4231.81,5.04,putting people first we're going beyond
4234.21,6.09,the idea of a smart home to create a
4236.85,4.86,truly helpful home over the past year
4240.3,3.93,we've brought the nest in Google teams
4241.71,5.1,together to deliver on our vision of the
4244.23,5.31,helpful home and today we're further
4246.81,5.69,simplifying things bringing all of these
4249.54,6.03,products together under the nest name as
4252.5,5.98,a single team and a single product
4255.57,4.59,family we're following a set of guiding
4258.48,5.7,principles that reflect our commitment
4260.16,6.45,to putting people first now to start we
4264.18,4.11,believe technology should be easy for
4266.61,5.64,everyone in the home to use whether
4268.29,5.79,they're five or ninety five the helpful
4272.25,3.87,home should also be personal for
4274.08,4.2,everyone with Google assistant at the
4276.12,4.71,core we can provide a personalized
4278.28,5.85,experience for the entire household even
4280.83,6.12,in communal spaces and the tech in your
4284.13,5.1,home should work together for a single
4286.95,5.52,seamless experience across rooms and
4289.23,5.4,devices most importantly the helpful
4292.47,5.61,home needs to respect your privacy
4294.63,5.61,and today we're publishing privacy
4298.08,4.62,commitments for our home products that
4300.24,6.17,clearly explain how they work the data
4302.7,3.71,we're storing and how it's used
4306.78,6.029,[Applause]
4310.559,4.05,our vision for the helpful home is
4312.809,4.56,anchored in the insistant and as you
4314.609,5.34,heard from Scott we're continuing to get
4317.369,4.05,more helpful over time we want to make
4319.949,2.72,sure that you can get the help you need
4321.419,4.74,where you need it
4322.669,6.37,Google Home Hub which were renaming nest
4326.159,5.101,hub was designed specifically to bring
4329.039,5.011,the helpfulness of the assistant to any
4331.26,5.279,room in your house now we've also been
4334.05,4.079,working on a new display that builds on
4336.539,4.14,the things that people love about hub
4338.129,4.19,but is designed for communal spaces in
4340.679,9.871,the home or the family gathers
4342.319,10.691,introducing nest hub max it's a new
4350.55,4.769,product that has a camera in a larger 10
4353.01,4.979,inch display which is perfect for the
4355.319,4.77,center of your helpful home hub max
4357.989,4.291,pulls together your connected devices
4360.089,5.01,together into a home view dashboard
4362.28,5.129,where you can see your nest cams you can
4365.099,5.82,switch on lights control your music and
4367.409,6.24,adjust your thermostat hub max also
4370.919,4.83,supports thread so just like nest
4373.649,4.89,connect it communicates directly with
4375.749,5.281,thread supported devices that need a
4378.539,5.491,low-power connection like door locks or
4381.03,6,motion sensors and we've designed hub
4384.03,5.159,max with an incredibly helpful camera if
4387.03,2.549,you want to know what's going on in your
4389.189,2.69,home
4389.579,4.62,you can choose to use it like a nest cam
4391.879,4.6,you can turn it on when you're away from
4394.199,4.62,home you can check on things right from
4396.479,4.29,the nest app and your phone and just
4398.819,4.08,like a nest cam it's easy to see your
4400.769,4.14,vent history an able home and away
4402.899,4.2,assist and you also get a notification
4404.909,3.51,if the camera detects any motion or see
4407.099,6.27,someone it doesn't recognize in your
4408.419,7.65,home now video calling is easy too with
4413.369,5.4,Google duo the camera has a wide-angle
4416.069,5.22,lens and it automatically adjusts to
4418.769,6.33,keep you centered in the frame you can
4421.289,7.35,chat with any iOS or Android device or a
4425.099,6.21,PC with a Chrome browser you can also
4428.639,6.57,you also use duo to leave video messages
4431.309,6.33,for members of your household hub max is
4435.209,3.091,designed to give you full control over
4437.639,2.79,the camera
4438.3,4.319,nothing is streamed or recorded unless
4440.429,4.26,you intentionally enable it and you'll
4442.619,5.85,always know when the cameras on with a
4444.689,5.73,green indicator light you have multiple
4448.469,3.331,controls to disable camera features and
4450.419,3.69,a physical switch on the back
4451.8,5.099,electrically disconnects the camera on
4454.109,6.53,the microphones and you can see all
4456.899,3.74,these controls clearly on the display
4460.939,10.66,hub max thank you hub max is designed to
4469.739,4.41,be used by multiple people in your home
4471.599,5.37,and provide everyone with the help they
4474.149,5.131,need in a personalized way now to help
4476.969,4.47,with that we've offered users the choice
4479.28,4.529,to enable voice match so the assistant
4481.439,5.28,can recognize their voice and respond
4483.809,4.56,directly to you but today we're also
4486.719,4.44,extending the options to personalize
4488.369,6.03,using the camera with a feature we call
4491.159,5.46,face match for each person in your
4494.399,3.54,family that chooses to turn it on the
4496.619,3.78,assistant guides you through a process
4497.939,5.97,of creating a face model which is then
4500.399,5.28,encrypted and stored on the device then
4503.909,4.29,whenever you walk in front of the camera
4505.679,5.51,hub max recognizes you and shows just
4508.199,5.64,your information and not anyone elses
4511.189,5.29,face matches facial recognition
4513.839,4.65,technology is processed locally on the
4516.479,4.051,device using on device machine learning
4518.489,5.55,so the camera data never leaves the
4520.53,5.639,device and in the morning I can walk
4524.039,4.2,into the kitchen and the assistant knows
4526.169,4.47,to greet me with my calendar my
4528.239,4.021,commuting details the weather and any
4530.639,5.01,other information I need to start my day
4532.26,6,and when I get home hub max
4535.649,4.68,welcomes me home with any reminders that
4538.26,3.54,might be waiting for me and the
4540.329,4.02,assistant offers personalized
4541.8,4.079,recommendations for music and TV shows
4544.349,5.13,and I can even see if anyone's left me a
4545.879,6.39,video message one of my favorite things
4549.479,5.52,about hub max is that it's a great
4552.269,4.531,digital photo frame no matter what kind
4554.999,3.63,of day I'm having nothing makes me feel
4556.8,3.469,better than seeing some of my favorite
4558.629,4.2,memories on this beautiful screen and
4560.269,5.02,the Google Photos integration makes this
4562.829,4.77,whole process really simple I can select
4565.289,4.5,my family and friends and hub max
4567.599,4.56,displays the best photos of them from
4569.789,4.92,years ago or from earlier today
4572.159,4.23,and now with a simple voice commands
4574.709,6.151,sharing my favorite shots is
4576.389,6.991,easier than ever the big screen also
4580.86,5.4,makes hub max the kitchen TV you've
4583.38,5.009,always wanted tell it what you want to
4586.26,3.51,watch or if you need help deciding just
4588.389,4.681,ask the assistant to pull up our new
4589.77,5.58,on-screen guide hub max can stream your
4593.07,5.43,favorite live shows and sports on
4595.35,5.43,YouTube TV but unlike your kitchen TV it
4598.5,5.659,can also teach you how to cook see who's
4600.78,6.24,at the front door and play your music
