start,dur,text
1652.37,4.08,problem we've been solving and I'm
1653.99,5.01,really excited to share the realization
1656.45,5.309,of this vision is not far off in fact
1659,7.17,this next generation assistant is coming
1661.759,7.781,to the new pixel phones later this year
1666.17,5.35,[Applause]
1669.54,4.92,now our missions to make the assistant
1671.52,5.49,the best way to get things done you just
1674.46,4.5,saw how we're making it much faster but
1677.01,4.83,it also has to be personal enough to
1678.96,4.709,really help you now personalize helps
1681.84,4.53,especially important in areas where
1683.669,5.161,people's preferences completely differ
1686.37,4.95,like choosing what to listen to what to
1688.83,4.77,do on the weekend or even what to eat so
1691.32,5.09,let's look at a recipe example hey
1693.6,6.39,google what should I cook for dinner
1696.41,5.86,here are some recipe pics for you now as
1699.99,5.1,you can see the assistant picked recipes
1702.27,4.68,tailored to me for example it suggested
1705.09,3.48,a bourbon chicken recipe because it's
1706.95,4.38,helped me with barbecue recipes in the
1708.57,5.099,past now what I really love is that
1711.33,4.89,different people get completely
1713.669,5.161,different results we call this feature
1716.22,4.26,picks for you and it will be launching
1718.83,4.38,on smart displays later this summer
1720.48,6.03,starting with recipes podcasts and
1723.21,5.099,events now beyond your preferences
1726.51,3.93,becoming more personal means the
1728.309,4.201,assistant will better understand the
1730.44,4.2,people places and events that are
1732.51,3.99,important to you now one important
1734.64,4.409,person in my life is my mom who I'm
1736.5,4.83,gonna visit right after i/o so let's say
1739.049,4.681,I ask my assistant how's the traffic to
1741.33,5.52,mom's house and we all understand what I
1743.73,5.37,mean by mom's house right well if I'm in
1746.85,5.459,Toledo mom's house might have meant this
1749.1,5.4,place a non-profit childcare center in
1752.309,4.651,other cities mom's house can be a
1754.5,4.29,restaurant or a grocery store in fact
1756.96,5.58,there's lots of things in the world
1758.79,5.67,called mom's house now in linguistics
1762.54,4.29,the process is figuring out which thing
1764.46,4.709,a phrase refers to is called reference
1766.83,5.19,resolution and it's fundamental to
1769.169,4.351,understanding human language at Google
1772.02,3.3,we approach this problem using our
1773.52,4.409,knowledge graph of things in the world
1775.32,4.26,and their relationships it's what allows
1777.929,3.231,us to understand something like the
1779.58,4.8,Starbucks near the Golden Gate Bridge
1781.16,5.62,today we're expanding the assistants
1784.38,4.56,ability to understand you better by
1786.78,4.92,applying those same techniques to the
1788.94,5.4,things in your world we call it personal
1791.7,4.92,references so if I shared my mom's
1794.34,4.17,contact info with the assistant I can
1796.62,4.59,ask hey Google what's the weather like
1798.51,3.08,at Mom's house this weekend Friday and
1801.21,3.11,Saturday
1801.59,5.069,carmichael will be partly cloudy how
1804.32,4.68,long will take to get there with light
1806.659,5.041,traffic it will take you 2 hours and 14
1809,4.83,minutes to get to 123 Main Street by car
1811.7,4.589,remind me to order flowers a week before
1813.83,5.4,mom's birthday alright I'll remind you
1816.289,5.25,on July 3rd and it goes beyond mom
1819.23,4.29,if you've shared important people places
1821.539,3.841,and events with the assistant you'll be
1823.52,4.35,able to ask for things more naturally
1825.38,4.74,like show me photos of my son or
1827.87,4.71,directions to the restaurant reservation
1830.12,5.1,or remind me to pick up chocolates on my
1832.58,5.219,anniversary and rest assured you're
1835.22,4.92,always in control you can edit or delete
1837.799,5.901,this information at any time in the
1840.14,5.88,updated you tab in assistant settings
1843.7,4.859,now one place where the assistant can be
1846.02,5.97,especially helpful is in the car
1848.559,5.35,offering a safer hands-free way to get
1851.99,4.169,everything you need while you're on the
1853.909,3.661,road now we've been focused on the main
1856.159,3.211,things that we all want when we're
1857.57,4.079,driving to get where we're going safely
1859.37,3.98,to catch up with friends and to listen
1861.649,3.871,to something interesting along the way
1863.35,4.569,last year we brought the assistant to
1865.52,4.47,Android auto and earlier this year we
1867.919,5.071,added it to navigation in Google Maps
1869.99,6.24,I'm happy to share the assistant is also
1872.99,5.309,coming to ways in the next few weeks now
1876.23,3.66,I'd like to show you the future of how
1878.299,4.321,we're improving your mobile driving
1879.89,5.88,experience even more introducing the
1882.62,5.37,assistance new driving mode just put
1885.77,5.73,your phone in the car and say hey Google
1887.99,5.28,let's drive driving mode has a
1891.5,3.99,thoughtfully designed dashboard that
1893.27,4.2,brings your most relevant activities
1895.49,4.679,front and center while you're driving
1897.47,5.52,and includes suggestions personalized
1900.169,4.74,for you for example if you have a dinner
1902.99,4.23,reservation on your calendar you'll see
1904.909,4.921,a convenient shortcut to navigate to the
1907.22,4.77,restaurant or if you started a podcast
1909.83,4.589,at home in the morning once you get in
1911.99,4.559,your car it'll display a shortcut to
1914.419,4.98,resume the episode right where you left
1916.549,5.281,off now it also highlights top contacts
1919.399,5.071,making easy to call them or message them
1921.83,6.06,and recommendations for other things to
1924.47,5.85,listen to now once your navigating phone
1927.89,4.95,calls and music appear in a low-profile
1930.32,4.469,way so you can get things done without
1932.84,6.4,leaving your navigation screen
1934.789,6.25,hey Google play some jazz sure
1939.24,5.88,check out this jazz music station on
1941.039,6.601,YouTube music now everything is voice
1945.12,3.99,enabled so if a call comes in the
1947.64,4.019,assistant will tell you who's calling
1949.11,6.24,and ask if you want to answer without
1951.659,7.191,having to take your eyes off the road do
1955.35,6.11,you want to pick it up no thanks but
1958.85,5.199,thanks for your help with the demo mom
1961.46,4.719,all right so best of all with the
1964.049,4.411,assistant already on your phone there's
1966.179,4.86,no need to download an app just start
1968.46,5.13,driving driving mode will be available
1971.039,9.571,this summer on any Android phone with
1973.59,9.719,the assistant now today the Google
1980.61,6.12,assistant is available on over 1 billion
1983.309,6.72,devices in over 30 languages across 80
1986.73,5.669,countries and with duplex on the web the
1990.029,4.801,next generation assistant personalized
1992.399,4.621,help and assistant it's in the car we're
1994.83,4.979,continuing to build on our mission to be
1997.02,5.909,the fastest most personal way to help
1999.809,5.011,you get things done now before I go I
2002.929,3.811,want to share a little something that a
2004.82,8.54,lot of you have been asking for check
2006.74,6.62,this out stop
2018.21,6.059,now you can stop your timers and alarms
2020.97,6.299,just by saying stop no hey Google need
2024.269,4.591,it and it's rolling out on smart
2027.269,3.78,displays and Google homes in
2028.86,2.639,english-speaking look house starting
2031.049,1.961,today
2031.499,6.751,thanks very much
2033.01,10.799,[Applause]
2038.25,17.71,[Music]
2043.809,15.261,hey Google open the pod bay doors I
2055.96,3.11,[Music]
2060.089,6.04,found a few restaurants near you
2063.45,10.03,ordering you a grande vanilla latte from
2066.129,18.391,Starbucks this is a cat the forecast is
2073.48,12.75,72 and sunny how do I slice of mango
2084.52,4.23,turn alone to Christmas spirit
2086.23,4.939,begin operation Kevin operation Kevin
2088.75,2.419,underway
2091.59,3.04,show me I make an octopus costume on
2093.91,3.789,YouTube
2094.63,3.069,[Music]
2099.05,7.95,[Applause]
2104.349,5.02,thanks God it's great to see the
2107,5.819,momentum of Google assistant and how its
2109.369,5.581,able to help users get things done so
2112.819,5.01,far we've talked about building a more
2114.95,6.149,helpful Google it's equally important to
2117.829,5.611,us that we do this for everyone for
2121.099,5.7,everyone is a core philosophy for us at
2123.44,6.21,Google that's why from the earliest days
2126.799,5.701,search works the same whether you're a
2129.65,6.51,professor at Stanford or a student in
2132.5,6.329,rural Indonesia it's why we build
2136.16,5.76,affordable laptops for classrooms
2138.829,5.821,everywhere and it's why we care about
2141.92,5.369,the experience on low-cost phones in
2144.65,5.939,countries where users are just starting
2147.289,6.391,to come online with the same passion as
2150.589,5.73,we do with premium phones and it goes
2153.68,4.71,beyond our products and services it's
2156.319,4.53,why we offer free training and tools
2158.39,5.669,through grow at Google helping people
2160.849,6.061,grow their skills find jobs and build
2164.059,5.97,their businesses and it's how we develop
2166.91,6.149,our technology ensuring the responsible
2170.029,4.32,development of AI privacy and security
2173.059,4.441,that works for everyone
2174.349,6.18,and products that are accessible at
2177.5,6.63,their core let's start with building AI
2180.529,5.881,for everyone bias has been a concern in
2184.13,4.83,science long before machine learning
2186.41,5.76,came along but the stakes are clearly
2188.96,6.839,higher with AI it's not enough to know
2192.17,7.199,if your model works we need to know how
2195.799,7.53,it works we want to ensure that our AI
2199.369,6.45,models don't reinforce bias that exists
2203.329,4.71,in the real world it's a hard problem
2205.819,5.19,which is why we are doing fundamental
2208.039,5.191,computer science research to improve the
2211.009,4.741,transparency of machine learning models
2213.23,5.4,and reduce bias let me show you what I
2215.75,5.279,mean when computer scientists deploy
2218.63,5.34,machine learning models it can sometimes
2221.029,5.58,be difficult to understand why they make
2223.97,5.129,a certain prediction that's because most
2226.609,5.7,machine learning models appear to
2229.099,5.91,operate on lower level features edges
2232.309,4.051,and lines in a picture color of a single
2235.009,2.761,pixel
2236.36,3.96,that's very different than the
2237.77,7.83,higher-level concepts more familiar to
2240.32,5.97,humans like stripes on a zebra to tackle
2245.6,3.27,this problem
2246.29,5.76,googly-eye researchers are working on a
2248.87,6.15,new methodology called decaf or testing
2252.05,5.52,with concept activation vectors let me
2255.02,5.54,give you an example if it's a machine
2257.57,5.91,learning model trained to detect zebras
2260.56,5.11,you would want to know which variables
2263.48,5.4,were being used to decide if the image
2265.67,5.52,contained a zebra or not decaf can help
2268.88,4.23,you understand if the concept of stripes
2271.19,5.76,was important to the models prediction
2273.11,5.55,in this particular case it makes sense
2276.95,6.51,stripes are an important predictor for
2278.66,7.59,the model now suppose a classifier was
2283.46,5.43,trained on pictures of doctors if the
2286.25,6,training data was mostly males wearing
2288.89,6.18,coats and stethoscopes then the model
2292.25,5.69,could inaccurately assume that being
2295.07,5.43,male was an important prediction factor
2297.94,6.55,there are other important examples as
2300.5,6.96,well now imagine an AI system that could
2304.49,5.94,help with detecting skin cancer to be
2307.46,5.42,effective it would need to recognize a
2310.43,5.21,vied variety of skin tones
2312.88,6.31,representative of the entire population
2315.64,5.68,there's a lot more to do but we are
2319.19,6.32,committed to building AI in a way that's
2321.32,6.66,fair and works for everyone including
2325.51,6.16,identifying and addressing bias in our
2327.98,7.8,own ml models and sharing tools and open
2331.67,6.48,datasets to help you as well another way
2335.78,4.23,we built for everyone is by ensuring
2338.15,4.56,that our products are safe and private
2340.01,5.46,and that people have clear meaningful
2342.71,5.58,choices around their data we strongly
2345.47,6.63,believe that privacy and security are
2348.29,5.97,for everyone not just a few this is why
2352.1,3.69,powerful privacy features and controls
2354.26,4.86,have always been built into Google
2355.79,6.66,services we launched incognito mode in
2359.12,5.31,chrome over a decade ago the pioneered
2362.45,5.55,Google takeout which gives you easy
2364.43,6.12,controls to export your data from email
2368,6.45,contacts photos all of our
2370.55,6.39,anytime you choose to but we know our
2374.45,5.22,work on privacy and security is never
2376.94,4.98,done and we want to do more to stay
2379.67,4.83,ahead of constantly evolving user
2381.92,4.65,expectations we've been working on a
2384.5,6,significant set of enhancements and I
2386.57,6.69,want to talk you through a few today you
2390.5,4.8,can already find all your privacy and
2393.26,5.61,security settings in one place in your
2395.3,6.27,Google account to make sure your Google
2398.87,5.34,account is always at your fingertips we
2401.57,5.61,are making it easily accessible from
2404.21,5.97,your profile photo if you're in search
2407.18,5.52,you can tap on your photo and you can
2410.18,5.46,quickly access the most relevant privacy
2412.7,6.33,controls for search in case your data in
2415.64,6.54,search here you can view and manage your
2419.03,7.26,recent activity and you can easily
2422.18,7.71,change your privacy settings last week
2426.29,5.55,we announced auto-delete controls which
2429.89,5.49,you'll all also be able to access right
2431.84,6.78,from that data helps make search work
2435.38,5.22,better for you and with auto-delete you
2438.62,6.2,can choose how long you want it to be
2440.6,7.8,saved for example 3 or 18 months after
2444.82,5.29,which any old data will be automatically
2448.4,3.05,and continuously deleted from your
2450.11,4.5,account
2451.45,5.32,this is launching today for web and app
2454.61,4.2,activity we'll be rolling it out to
2456.77,4.44,location history in the coming weeks and
2458.81,5.52,we'll continue to bring features such as
2461.21,6.21,this to more controls over time in
2464.33,4.95,addition one tap access to your Google
2467.42,5.45,account will be coming to our major
2469.28,7.77,products including chrome search
2472.87,8.2,assistant YouTube Google News and maps
2477.05,5.01,and speaking of maps if you tap on your
2481.07,3.54,profile photo
2482.06,4.77,in addition defining easy access to your
2484.61,5.55,privacy controls you'll find a new
2486.83,5.07,feature incognito mode incognito mode as
2490.16,3.93,a pop has been a popular feature in
2491.9,4.71,chrome since it launched and we are
2494.09,5.55,bringing this to maps while in incognito
2496.61,5.79,in maps your activity like the places
2499.64,4.26,you search and navigate to won't be
2502.4,4.02,linked to your account
2503.9,5.13,we want to make it easy to enter in and
2506.42,5.79,out of incognito and maps will soon join
2509.03,5.31,Chrome and YouTube with support for
2512.21,13.86,incognito and we'll be bringing it to
2514.34,15.3,search as well this year another way we
2526.07,6.3,ensure your privacy is by working hard
2529.64,4.68,to keep your data secure from Safe
2532.37,4.56,Browsing which now protects over four
2534.32,4.47,billion devices every day to using
2536.93,3.6,tensorflow to significantly reduce
2538.79,5.25,phishing attacks in Gmail
2540.53,6.27,we also encourage users to use 2-step
2544.04,6.45,verification because an additional layer
2546.8,5.88,of protection is always helpful today we
2550.49,4.74,are making 2-step verification even more
2552.68,5.04,convenient for everyone by bringing the
2555.23,5.25,protection of security keys directly
2557.72,5.87,into your Android phone so now you can
2560.48,6.06,confirm a sign-in with just a tap and
2563.59,6.39,today it'll be available to over 1
2566.54,3.44,billion compatible devices
2571.03,7.52,[Applause]
2574.41,7.32,we always want to do more for users but
2578.55,4.95,do it with less data over time so we are
2581.73,4.05,applying the same cutting-edge VI
2583.5,5.52,research that makes our products better
2585.78,7.44,and applying it to your hands user
2589.02,6.69,privacy federated learning this is a new
2593.22,5.31,approach to machine learning developed
2595.71,5.7,by Google is one example it allows
2598.53,5.58,Google's AI products to work better for
2601.41,5.75,you and work better for everyone without
2604.11,7.11,collecting raw data from your device's
2607.16,6.04,instead of selling data to the cloud we
2611.22,5.22,flip the model we ship machine learning
2613.2,6,models directly to your device each
2616.44,6,phone computes an update to the global
2619.2,7.14,model and only those updates not the
2622.44,6.24,data is securely uploaded and aggregated
2626.34,5.43,in large batches to improve the global
2628.68,6.33,model and then the updated global model
2631.77,6.15,is sent back to everyone's device let me
2635.01,6.39,explain it with a concrete example take
2637.92,5.76,G board Google's keyboard using on
2641.4,5.31,device learning alone when new words
2643.68,4.86,become popular G board would not be able
2646.71,2.84,to suggest them until you have typed
2648.54,4.08,them many times
2649.55,6.79,federated learning however allows G
2652.62,7.02,board to learn new words like BTS or
2656.34,5.43,Yolo after thousands of people start
2659.64,4.95,using them without Google ever seeing
2661.77,6.09,anything you type actually with BTS is
2664.59,5.82,probably millions of people this is not
2667.86,5.34,just research in fact G board is already
2670.41,5.28,using federated learning to improve next
2673.2,4.95,word prediction as well as emoji
2675.69,5.76,prediction across tens of millions of
2678.15,5.28,devices it's still very early but we are
2681.45,4.74,excited about the progress and the
2683.43,6.65,potential of federated learning across
2686.19,3.89,many more of our products
2694.33,4.39,privacy and security are the foundation
2696.74,4.59,for all the work we do and will continue
2698.72,5.33,to push the boundaries of technology to
2701.33,5.91,make it even better for our users
2704.05,5.53,building for everyone also means
2707.24,5.52,ensuring that everyone can access our
2709.58,6.09,products the World Health Organization
2712.76,6.27,estimates that 15 percent of the world's
2715.67,6.96,population over 1 billion people has a
2719.03,6.87,disability we believe technology can
2722.63,5.19,help us be more inclusive and AI is
2725.9,4.53,providing us with new tools to
2727.82,5.27,dramatically improve experience for
2730.43,5.55,people with disabilities for example
2733.09,5.59,there are almost 500 million people in
2735.98,5.19,the world who are deaf or hard of
2738.68,5.34,hearing think of how many conversations
2741.17,5.49,are challenging from in person
2744.02,6.78,discussions and phone calls to even
2746.66,7.8,experiencing videos online a few months
2750.8,7.14,ago we launched live transcribe powered
2754.46,6.66,by Google's cloud speech API to caption
2757.94,5.64,conversations in real time you can leave
2761.12,5.16,your phone open with the app and when
2763.58,5.4,someone speaks to you it transcribes
2766.28,6.21,their speech into text those who cannot
2768.98,6.63,or prefer not to speak can also respond
2772.49,5.67,by typing was really inspired by how the
2775.61,5.97,product came about to offer our Google
2778.16,5.22,researchers Dimitri and Chet saw an
2781.58,3.53,opportunity to help people and
2783.38,4.53,collaborate it to develop the app
2785.11,6.52,together with a small team of engineers
2787.91,6.39,and people who volunteered their 20%
2791.63,4.86,time they built live transcribe and it
2794.3,6.14,is now available in over 70 languages
2796.49,3.95,and dialects on Android devices
2801.12,5.729,[Applause]
2803.39,5.86,today we are going further and extending
2806.849,5.581,this technology we are announcing a new
2809.25,6.24,feature called live caption live caption
2812.43,5.329,makes all content no matter its origin
2815.49,4.349,more accessible to everyone
2817.759,4.681,incredible thing is that it works
2819.839,6.27,completely on device so there's no delay
2822.44,7.599,with one click you can turn on captions
2826.109,22.44,for a web video podcast or even on a
2830.039,20.73,moment you capture at home only possible
2848.549,5.04,due to our recent breakthroughs in
2850.769,5.371,speech recognition technology we
2853.589,7.44,recently tested live caption with some
2856.14,7.8,uses let's take a look this volume
2861.029,15.06,button here and then we turn on that
2863.94,16.05,button amazing it feels like wow it's
2876.089,5.881,such a simple feature but it has such an
2879.99,4.289,impact on me it's gonna make our lives
2881.97,4.2,so much easier I wake up two o'clock in
2884.279,3.921,the morning to walk so wake up my mom or
2886.17,2.03,dad
2891.84,3.5,[Applause]
2895.64,5.5,you can imagine all the use cases for
2898.53,5.58,the broader community - for example the
2901.14,5.4,ability to watch any video if you're in
2904.11,4.92,a meeting or on the subway without
2906.54,3.96,disturbing the people around you the
2909.03,3.3,Android team is going to talk a little
2910.5,4.74,bit later today about what made live
2912.33,5.25,caption possible we are also exploring
2915.24,5.01,how this technology can caption phone
2917.58,5.97,calls but we want to go one step further
2920.25,6.78,and actually allow more people to
2923.55,6.99,respond and accomplish tasks over their
2927.03,6.78,phones as you see in this example Nicole
2930.54,6.3,who is deaf and prefers not to speak can
2933.81,6.09,receive a call from her hairstylist with
2936.84,5.61,smart compose and smart reply she can
2939.9,9.42,answer the call and interact let's take
2942.45,8.64,a look hi this is Nicole's assistive
2949.32,3.33,Chat she'll see what you say and her
2951.09,2.69,responses will be read back to you
2952.65,6.99,starting now
2953.78,10.78,hi Nicole its Jaime how are you hey
2959.64,6.18,Jaime I'm good and you great are we
2964.56,9.27,still on for your 1:00 p.m. haircut
2965.82,10.44,tomorrow sorry can you do 3 p.m. uh yes
2973.83,6.32,I can do 3 p.m. we have a lot to catch
2976.26,6.05,up on I want to hear all about your trip
2980.15,6.58,perfect thumbs up
2982.31,6.78,great see you tomorrow bye thumbs up
2986.73,3.65,indeed
2989.09,3.969,[Applause]
2990.38,6.01,[Music]
2993.059,5.891,we call this new technology live relay
2996.39,5.439,while there's still more work to do
2998.95,5.49,we are excited to see how it can help
3001.829,5.881,people like Nicole get things done more
3004.44,5.79,easily just like with live caption this
3007.71,5.67,runs completely on device and these
3010.23,4.769,conversations remain private to you we
3013.38,4.439,also want to help those with speech
3014.999,6.77,disorders or people whose speech has
3017.819,7.05,been affected by a stroke or ALS
3021.769,5.29,researchers from google AI are exploring
3024.869,4.561,the idea of personalized communication
3027.059,5.19,models that can better understand
3029.43,6.329,different types of speech as well as how
3032.249,7.02,a I can help even those who cannot speak
3035.759,14.371,to communicate we call this research
3039.269,18.74,project Dafoe Nia let's take a look but
3050.13,7.879,it is not fun it will not offend to you
3058.549,5.171,no one's ever Co active large datasets
3061.019,7.401,of people whose speech is hard for
3063.72,10.799,others to understand we're okay working
3068.42,8.109,for GF who cuts so bad ever they're not
3074.519,6.081,used in training the speech recognition
3076.529,6.841,models the game is is to record things
3080.6,5.13,and then have it recognized things that
3083.37,7.8,you say that aren't in the trainings
3085.73,7.42,"you're Dimitri recorded 15,000 phrase it"
3091.17,6.89,wasn't obvious that this was going to
3093.15,4.91,work he just sat there he kept recording
3098.63,13.71,all interactive devices able to
3104.75,7.59,understand any person who speaks to them
3112.4,6.01,you can see that it's possible to make a
3115.44,4.65,speech recognizer to work for Dimitri it
3118.41,3.66,should be possible to make it work for
3120.09,3.27,many people even people if you can't
3122.07,2.85,speak because they've lost the ability
3123.36,4.25,to speak the work that Zhang Sheng is
3124.92,8.88,done on you know voice utterances from
3127.61,7.78,sounds alone you can communicate but
3133.8,2.31,there might be other ways of
3135.39,3.87,communicating
3136.11,5.85,most people with ALS end up using an
3139.26,5.09,on-screen keyboard and having to type
3141.96,3.87,each individual letter with their eyes
3144.35,5.83,for me
3145.83,5.88,communicating is Steve Mike crack a joke
3150.18,3.27,and it's related to something that
3151.71,3.59,happened you know a few minutes ago the
3153.45,4.38,idea is to create a tool so that Steve
3155.3,4.66,constrain machine learning models him
3157.83,3.95,stone to understand his facial
3159.96,5.529,expressions
3161.78,6.299,[Applause]
3165.489,5.8,to be able to laugh to be able to cheer
3168.079,6.12,to be able to boo things that seem maybe
3171.289,5.67,so worthless but actually aren't so core
3174.199,4.02,to human I still think this is only the
3176.959,3.75,tip of the iceberg we're not even
3178.219,3.63,scratching the surface yet of what is
3180.709,2.85,possible if we can get speech
3181.849,3.42,recognizers to work with small numbers
