Id,"Nombre de réponse","Nombre de like",Date,Auteur,Texte,"Répond à"
UgzSv7PyCdX3eJzYrwh4AaABAg,0,14,2022-05-16,FarEazy,"Make a video series about weakspot, we increasingly know the weaknesses of the enemy and our own tanks. thank you"
UgxyYPDFfO_NP6L8N914AaABAg,0,9,2022-05-16,"NOOBSLAYER 3007","ah yes Ferdinand now has to face T54s"
Ugzf-iVqE21pde2DsPB4AaABAg,0,0,2022-05-16,"Vidura Herath","I love the realism of warthunder, the cold war era tanks fighting the ww2 german ground vehicles really makes it historically accurate"
Ugz4cZOVMTkwOjy9ZTJ4AaABAg,0,7,2022-05-16,QuýHandsomeAsHell,"germany last defensive battle, argentina 1970 i think"
UgxgQUY2BahprwlTCIp4AaABAg,0,7,2022-05-16,"O-HO gameplay","historically accurate"
UgwYPirfMTGAmV7EHqV4AaABAg,0,3,2022-05-16,"Grieve Tan","Oh boy I sure do love fighting against cold war era vehicles in my 1943 Ferdinand"
UgyZ6wA8qyMHXgFv-ip4AaABAg,0,1,2022-05-16,"Кот Василий","War thunder fans: weakspots in wot too unrealistic noooooo
Also war thunder fans:"
Ugx30e5ruOoPRkXGRcx4AaABAg,0,1,2022-05-16,"Panzerkampfwagen VIII Maus","I bully t54 and t55 in my m103"
